zone,x_mm,y_mm,w_mm,h_mm,z_height_mm,notes
battery_footprint,20,18,275,230,190 visual reference; measure actual battery,"Current battery datum inside compact 315 x 265 tray; final footprint, full case height, and terminal side follow actual battery."
compact_top_tray,0,0,315,265,3 mm steel tray/deck plus battery mat,Compact battery support tray only; do not use the tray skin as a large electrical backplane.
relay_rev_c_low_front_card,"front face, centred to battery tray where possible",low/front vertical cassette,320,220,"finished face plus 20 mm side/bottom returns, 15 mm top return, relay box and loom depth measurement hold",Active candidate is low on the front/radiator-side cassette so it does not consume the inboard engine/LHD side gap.
midi_rev_c_top_front_shelf_card,"top-front shelf, inside front cassette width",above front relay tray if bonnet clearance passes,190,150,known 190 x 150 plate plus 140 x 85 subplate and holder/cable depth,Open plate/subplate assembly on a shallow top-front shelf; do not mount it on the engine-side face.
cutoff_top_front_access_card,top/front accessible corner,"adjacent to MIDI shelf, not engine-side",170,110,"210 x 150 mm flat pattern, 170 x 110 mm finished face, 20 mm upward guard lips, plus switch body/knob/stud height measurement hold",Folded aluminium base/guard at the most accessible top/front position; lips bend upward around the switch/terminal side. Open final switch hole after measuring real switch.
front_radiator_service_cassette_spine,site_fit,site_fit,325,120,component and cable-lug depth measurement hold,Vehicle-side spine for the front-cassette stack; mounts relay low and provides top-front shelf/tab pickups for MIDI and cutoff.
inboard_engine_lhd_keep_clear,engine-side boundary from battery face,full service height,measurement_hold,measurement_hold,steering/hose/alternator/heat/service envelope,"Do not place relay, MIDI, or cutoff faces here by default. Use only protected cable clips/pass-throughs after steering, hose, heat, and service sweeps are proven."
single_chassis_pickup,site_fit,site_fit,220,230 nominal developed pattern; adjust cap width to measured rail,image estimate: 170-190 mm chassis-top-to-tray-underside target; adjustable 150-210 mm,One 4 mm formed saddle goes over the chassis rail with legs down both sides and through-bolts at the known vehicle-side chassis location. May 14 no-battery bay photo suggests starting with 180 mm vertical rise from chassis top to tray underside.
tray_side_jog_from_chassis_pickup,image estimate: tray centre about 120 mm wing-side/outboard from chassis pickup centreline,site_fit with battery in original pocket,90-150 adjustment range,n/a,same tray plane as compact_top_tray,"Use slotted upper bridge holes or removable spacers/packers to tune side position. Keep the battery in the existing pocket and keep the engine/LHD side clear for steering, hose, and service sweep."
